{"arms":{"baseline":{"binarySha256":"883ed7e4e1a11fbb035a619c96ffb949793635c8493253ea005512ecc0533902","cases":[{"agentVisibleCallCount":16,"checks":{"completionPassed":true,"documentsValid":true,"graphIntegrityPassed":true,"noUnexpectedFailures":true,"sourcePolicyPassed":true},"durationMs":{"median":77.004,"p95":82.123},"errorCounts":{},"family":"typed-add","finalSuccessCount":16,"finalSuccessHistogram":{"2":8},"groupSize":2,"initialSuccessCount":16,"initialSuccessHistogram":{"2":8},"mutationCallCount":16,"otherFailureCount":0,"recoveryReadCount":0,"repetitionCount":8,"retryCallCount":0,"visibleConflictCount":0,"visibleConflictEpisodeCount":0,"writerIntentCount":16},{"agentVisibleCallCount":32,"checks":{"completionPassed":true,"documentsValid":true,"graphIntegrityPassed":true,"noUnexpectedFailures":true,"sourcePolicyPassed":true},"durationMs":{"median":113.004,"p95":118.965},"errorCounts":{},"family":"typed-add","finalSuccessCount":32,"finalSuccessHistogram":{"4":8},"groupSize":4,"initialSuccessCount":32,"initialSuccessHistogram":{"4":8},"mutationCallCount":32,"otherFailureCount":0,"recoveryReadCount":0,"repetitionCount":8,"retryCallCount":0,"visibleConflictCount":0,"visibleConflictEpisodeCount":0,"writerIntentCount":32},{"agentVisibleCallCount":64,"checks":{"completionPassed":true,"documentsValid":true,"graphIntegrityPassed":true,"noUnexpectedFailures":true,"sourcePolicyPassed":true},"durationMs":{"median":204.679,"p95":222.517},"errorCounts":{},"family":"typed-add","finalSuccessCount":64,"finalSuccessHistogram":{"8":8},"groupSize":8,"initialSuccessCount":64,"initialSuccessHistogram":{"8":8},"mutationCallCount":64,"otherFailureCount":0,"recoveryReadCount":0,"repetitionCount":8,"retryCallCount":0,"visibleConflictCount":0,"visibleConflictEpisodeCount":0,"writerIntentCount":64},{"agentVisibleCallCount":130,"checks":{"completionPassed":true,"documentsValid":true,"graphIntegrityPassed":true,"noUnexpectedFailures":true,"sourcePolicyPassed":true},"durationMs":{"median":444.347,"p95":459.059},"errorCounts":{"COLLABORATION_PRECONDITION_FAILED":1},"family":"typed-add","finalSuccessCount":128,"finalSuccessHistogram":{"16":8},"groupSize":16,"initialSuccessCount":127,"initialSuccessHistogram":{"15":1,"16":7},"mutationCallCount":129,"otherFailureCount":0,"recoveryReadCount":1,"repetitionCount":8,"retryCallCount":1,"visibleConflictCount":1,"visibleConflictEpisodeCount":1,"writerIntentCount":128},{"agentVisibleCallCount":316,"checks":{"completionPassed":true,"documentsValid":true,"graphIntegrityPassed":true,"noUnexpectedFailures":true,"sourcePolicyPassed":true},"durationMs":{"median":1124.712,"p95":1245.376},"errorCounts":{"COLLABORATION_PRECONDITION_FAILED":30},"family":"typed-add","finalSuccessCount":256,"finalSuccessHistogram":{"32":8},"groupSize":32,"initialSuccessCount":226,"initialSuccessHistogram":{"27":2,"28":2,"29":4},"mutationCallCount":286,"otherFailureCount":0,"recoveryReadCount":30,"repetitionCount":8,"retryCallCount":30,"visibleConflictCount":30,"visibleConflictEpisodeCount":8,"writerIntentCount":256},{"agentVisibleCallCount":16,"checks":{"completionPassed":true,"documentsValid":true,"graphIntegrityPassed":true,"noUnexpectedFailures":true,"sourcePolicyPassed":true},"durationMs":{"median":72.684,"p95":86.419},"errorCounts":{},"family":"suggestion-add","finalSuccessCount":16,"finalSuccessHistogram":{"2":8},"groupSize":2,"initialSuccessCount":16,"initialSuccessHistogram":{"2":8},"mutationCallCount":16,"otherFailureCount":0,"recoveryReadCount":0,"repetitionCount":8,"retryCallCount":0,"visibleConflictCount":0,"visibleConflictEpisodeCount":0,"writerIntentCount":16},{"agentVisibleCallCount":64,"checks":{"completionPassed":true,"documentsValid":true,"graphIntegrityPassed":true,"noUnexpectedFailures":true,"sourcePolicyPassed":true},"durationMs":{"median":179.415,"p95":186.415},"errorCounts":{"COLLABORATION_PRECONDITION_FAILED":16},"family":"suggestion-add","finalSuccessCount":32,"finalSuccessHistogram":{"4":8},"groupSize":4,"initialSuccessCount":16,"initialSuccessHistogram":{"2":8},"mutationCallCount":48,"otherFailureCount":0,"recoveryReadCount":16,"repetitionCount":8,"retryCallCount":16,"visibleConflictCount":16,"visibleConflictEpisodeCount":8,"writerIntentCount":32},{"agentVisibleCallCount":214,"checks":{"completionPassed":true,"documentsValid":true,"graphIntegrityPassed":true,"noUnexpectedFailures":true,"sourcePolicyPassed":true},"durationMs":{"median":390.979,"p95":470.276},"errorCounts":{"COLLABORATION_PRECONDITION_FAILED":75},"family":"suggestion-add","finalSuccessCount":64,"finalSuccessHistogram":{"8":8},"groupSize":8,"initialSuccessCount":21,"initialSuccessHistogram":{"2":3,"3":5},"mutationCallCount":139,"otherFailureCount":0,"recoveryReadCount":75,"repetitionCount":8,"retryCallCount":75,"visibleConflictCount":75,"visibleConflictEpisodeCount":8,"writerIntentCount":64},{"agentVisibleCallCount":586,"checks":{"completionPassed":false,"documentsValid":true,"graphIntegrityPassed":true,"noUnexpectedFailures":true,"sourcePolicyPassed":true},"durationMs":{"median":867.382,"p95":924.608},"errorCounts":{"COLLABORATION_PRECONDITION_FAILED":250},"family":"suggestion-add","finalSuccessCount":107,"finalSuccessHistogram":{"12":1,"13":3,"14":4},"groupSize":16,"initialSuccessCount":40,"initialSuccessHistogram":{"4":1,"5":6,"6":1},"mutationCallCount":357,"otherFailureCount":0,"recoveryReadCount":229,"repetitionCount":8,"retryCallCount":229,"visibleConflictCount":250,"visibleConflictEpisodeCount":8,"writerIntentCount":128},{"agentVisibleCallCount":1422,"checks":{"completionPassed":false,"documentsValid":true,"graphIntegrityPassed":true,"noUnexpectedFailures":true,"sourcePolicyPassed":true},"durationMs":{"median":1855.993,"p95":2310.719},"errorCounts":{"COLLABORATION_PRECONDITION_FAILED":665},"family":"suggestion-add","finalSuccessCount":174,"finalSuccessHistogram":{"19":1,"21":2,"22":3,"23":1,"24":1},"groupSize":32,"initialSuccessCount":57,"initialSuccessHistogram":{"6":3,"7":2,"8":2,"9":1},"mutationCallCount":839,"otherFailureCount":0,"recoveryReadCount":583,"repetitionCount":8,"retryCallCount":583,"visibleConflictCount":665,"visibleConflictEpisodeCount":8,"writerIntentCount":256},{"agentVisibleCallCount":32,"checks":{"completionPassed":true,"documentsValid":true,"graphIntegrityPassed":true,"noUnexpectedFailures":true,"sourcePolicyPassed":true},"durationMs":{"median":102.337,"p95":103.525},"errorCounts":{"COLLABORATION_PRECONDITION_FAILED":8},"family":"suggestion-reject","finalSuccessCount":16,"finalSuccessHistogram":{"2":8},"groupSize":2,"initialSuccessCount":8,"initialSuccessHistogram":{"1":8},"mutationCallCount":24,"otherFailureCount":0,"recoveryReadCount":8,"repetitionCount":8,"retryCallCount":8,"visibleConflictCount":8,"visibleConflictEpisodeCount":8,"writerIntentCount":16},{"agentVisibleCallCount":128,"checks":{"completionPassed":true,"documentsValid":true,"graphIntegrityPassed":true,"noUnexpectedFailures":true,"sourcePolicyPassed":true},"durationMs":{"median":258.061,"p95":280.833},"errorCounts":{"COLLABORATION_PRECONDITION_FAILED":48},"family":"suggestion-reject","finalSuccessCount":32,"finalSuccessHistogram":{"4":8},"groupSize":4,"initialSuccessCount":8,"initialSuccessHistogram":{"1":8},"mutationCallCount":80,"otherFailureCount":0,"recoveryReadCount":48,"repetitionCount":8,"retryCallCount":48,"visibleConflictCount":48,"visibleConflictEpisodeCount":8,"writerIntentCount":32},{"agentVisibleCallCount":416,"checks":{"completionPassed":false,"documentsValid":true,"graphIntegrityPassed":true,"noUnexpectedFailures":true,"sourcePolicyPassed":true},"durationMs":{"median":678.343,"p95":700.879},"errorCounts":{"COLLABORATION_PRECONDITION_FAILED":200},"family":"suggestion-reject","finalSuccessCount":40,"finalSuccessHistogram":{"5":8},"groupSize":8,"initialSuccessCount":8,"initialSuccessHistogram":{"1":8},"mutationCallCount":240,"otherFailureCount":0,"recoveryReadCount":176,"repetitionCount":8,"retryCallCount":176,"visibleConflictCount":200,"visibleConflictEpisodeCount":8,"writerIntentCount":64},{"agentVisibleCallCount":944,"checks":{"completionPassed":false,"documentsValid":true,"graphIntegrityPassed":true,"noUnexpectedFailures":true,"sourcePolicyPassed":true},"durationMs":{"median":1466.24,"p95":1524.669},"errorCounts":{"COLLABORATION_PRECONDITION_FAILED":489},"family":"suggestion-reject","finalSuccessCount":47,"finalSuccessHistogram":{"5":2,"6":5,"7":1},"groupSize":16,"initialSuccessCount":11,"initialSuccessHistogram":{"1":5,"2":3},"mutationCallCount":536,"otherFailureCount":0,"recoveryReadCount":408,"repetitionCount":8,"retryCallCount":408,"visibleConflictCount":489,"visibleConflictEpisodeCount":8,"writerIntentCount":128},{"agentVisibleCallCount":2002,"checks":{"completionPassed":false,"documentsValid":true,"graphIntegrityPassed":true,"noUnexpectedFailures":true,"sourcePolicyPassed":true},"durationMs":{"median":3499.584,"p95":3641.533},"errorCounts":{"COLLABORATION_PRECONDITION_FAILED":1054},"family":"suggestion-reject","finalSuccessCount":75,"finalSuccessHistogram":{"10":4,"8":1,"9":3},"groupSize":32,"initialSuccessCount":15,"initialSuccessHistogram":{"1":1,"2":7},"mutationCallCount":1129,"otherFailureCount":0,"recoveryReadCount":873,"repetitionCount":8,"retryCallCount":873,"visibleConflictCount":1054,"visibleConflictEpisodeCount":8,"writerIntentCount":256},{"agentVisibleCallCount":16,"checks":{"completionPassed":true,"documentsValid":true,"graphIntegrityPassed":true,"noUnexpectedFailures":true,"sourcePolicyPassed":true},"durationMs":{"median":64.321,"p95":74.732},"errorCounts":{"COLLABORATION_PRECONDITION_FAILED":8},"family":"suggestion-accept","finalSuccessCount":8,"finalSuccessHistogram":{"1":8},"groupSize":2,"initialSuccessCount":8,"initialSuccessHistogram":{"1":8},"mutationCallCount":16,"otherFailureCount":0,"recoveryReadCount":0,"repetitionCount":8,"retryCallCount":0,"visibleConflictCount":8,"visibleConflictEpisodeCount":8,"writerIntentCount":16},{"agentVisibleCallCount":32,"checks":{"completionPassed":true,"documentsVali